{
  "recording_id": "20261010-0800",
  "status": "read_with_explicit_uncertainty",
  "paragraphs": [
    {
      "paragraph_id": "P5",
      "text": "Start in our Saturday class〔待核 EAU002：独立 ASR 为 “We are starting our Saturday class”，句首形式待核〕, so thanks for being here and spending time this Saturday. As you may remember, we now look at the MAC layer of Wi-Fi, and as we will see in a Wi-Fi, we have two different schemes for accessing the channel. One is called DCF, Distributed Coordination Function. This is a distributed scheme, as the name says, and it is the one that is actually implemented in our Wi-Fi cards. Actually nowadays we have an evolved version of it, but we will first, look at the basic version of this scheme. The second one is called point coordination function. This is a centralized access scheme. We will understand better what distributed and centralized access scheme means. The PCF〔待核 EAU001：独立 ASR 此处识作 DCF；保留原文 PCF，不能仅凭技术常识替换〕 is in the standard, it is specified by the standard, but it is not implemented in our phone.〔补回 EAA001，待核〕 So we will focus on the first one that is actually implemented.",
      "source_block_ids": [
        "5"
      ],
      "change_ids": [
        "EAC001",
        "EAC002",
        "EAU001",
        "EAU002",
        "EAA001",
        "EAF024",
        "EAF025"
      ],
      "timestamps_are_anchors": true
    },
    {
      "paragraph_id": "P7",
      "text": "We will just say a few words about the second one, and we will explain why it has been not implemented in practice. OK, so before starting, just a brief recap.〔待核 EAU003：独立 ASR 随后有 “Now we have new markets. This is good news. So as you may remember,”；markets 疑误识，未作为确定讲话补入〕",
      "source_block_ids": [
        "7"
      ],
      "change_ids": [
        "EAU003"
      ],
      "timestamps_are_anchors": true
    },
    {
      "paragraph_id": "P9",
      "text": "We stand in a Wi-Fi〔待核 EAU004：独立 ASR 为 “we stand on in Wi-Fi”；开头措辞不清，保留原文〕, we are dealing with the physical layer and the MAC layer. OK, so this standard specifies how these two layers work. That are the physical layer and the MAC layer. So, these are software, these are, this is software function. Physical layer is a bit of a hardware and a bit of software, OK? Because as we said, physical layer needs an antenna. It needs some electronics, the transceiver to transmit and receive. So that's hardware. And then there are some functions here at the physical layer that are implemented in software. Ok? So as we said.",
      "source_block_ids": [
        "9"
      ],
      "change_ids": [
        "EAU004",
        "EAC003"
      ],
      "timestamps_are_anchors": true
    },
    {
      "paragraph_id": "P11",
      "text": "Then here, there are other layers on top, other functions on top, right? And the MAC layer, we receive packets from the higher layers that need to be transmitted toward a receiver. OK? So the MAC layer gets these packets. When a packet arrives at the MAC layer, the MAC layer understands that it has to do something to then let the packet be transmitted. And be transmitted means that the packet needs to go down to the physical layer.",
      "source_block_ids": [
        "11"
      ],
      "change_ids": [
        "EAC004",
        "EAC005",
        "EAF026",
        "EAF027"
      ],
      "timestamps_are_anchors": true
    },
    {
      "paragraph_id": "P13",
      "text": "Here we have modulation and etc. And then the antenna through which the bits impressed on the electromagnetic signal will be transmitted. And they will reach the signal, will reach the physical layer at the receiver. The physical layer performs demodulation. Then, if we consider that the packet is received successfully, it will go up through these layers, OK?",
      "source_block_ids": [
        "13"
      ],
      "change_ids": [
        "EAC006",
        "EAC007",
        "EAF001"
      ],
      "timestamps_are_anchors": true
    },
    {
      "paragraph_id": "P15",
      "text": "Now, Wi-Fi indeed, as we said, specifies what the physical and MAC layer, and the transmitter and the receiver do. Now, our transmitter may be a user Wi-Fi card that transmits toward the access point, or we may have the access point that transmits toward the user, Wi-Fi card, OK?",
      "source_block_ids": [
        "15"
      ],
      "change_ids": [
        "EAF002",
        "EAF003",
        "EAF028"
      ],
      "timestamps_are_anchors": true
    },
    {
      "paragraph_id": "P17",
      "text": "Now, when we have that the user transmits toward the access point, we call this transmission, a transmission on up link, OK? Because it's like the access point is typically high up, the user is at a lower height, so we transmit in up link when the user transmits toward the access point. Vice versa, when the access point transmits toward the user, we call that a downlink transmission. OK? So, up link is from the user to, down link is when the user receives something. Ok, that's it, we already describe a bit how the physical layer works, which frequencies we are using. We mentioned the fact that we use OFDM in order to transmit our signals. That's [00:07:17] physical layer. Now we are this morning we are starting with the MAC.〔补回 EAA002，待核〕 Okay, what the MAC layer functions do. As a general thing, as we said, the MAC layer functions will be there to understand when the node can access the channel. That means the packet can be sent as we said to the physical layer, and then actually transmit. Now, it is useful to model the MAC layer in this way.",
      "source_block_ids": [
        "17",
        "19"
      ],
      "change_ids": [
        "EAC008",
        "EAC009",
        "EAA002",
        "EAF029",
        "EAF030",
        "EAF064",
        "EAF065",
        "EAF066"
      ],
      "timestamps_are_anchors": true
    },
    {
      "paragraph_id": "P21",
      "text": "So, the MAC layer can be abstracted, seen as made of a queue and a server. Have you ever seen this kind of model? A queue model? No. It is often used to model many different systems. Originally, the researcher who many years ago proposed this kind of model, used this model to represent people who are in line at a supermarket cashier. OK, so you can think of this one that is called server, but it's not computing server as we now refer to, OK? It is, for example, in a supermarket, this is a cashier. In this is the queue.",
      "source_block_ids": [
        "21"
      ],
      "change_ids": [
        "EAC010",
        "EAC011",
        "EAC012",
        "EAF031",
        "EAF032",
        "EAF033",
        "EAF048"
      ],
      "timestamps_are_anchors": true
    },
    {
      "paragraph_id": "P23",
      "text": "〔补回 EAA003，待核〕 And people arrives right. When you go to the supermarket, if you get served by the cashier, then you have to line up, right? In queue, and there is the cashier here that serves the customers.",
      "source_block_ids": [
        "23"
      ],
      "change_ids": [
        "EAA003"
      ],
      "timestamps_are_anchors": true
    },
    {
      "paragraph_id": "P25",
      "text": "So, this model was used for example to represent customers in a queue, and to compute the latency, so the time that it takes to be served. Okay, a very similar scenario exists in networks in general, not just Wi-Fi, but in networks. In networks, very often, we have indeed this concept that packets arrive, they are like customers. They are queued as they arrive, and then there is a server that is just a function that serves these packets one by one in the same order as they arrive. Ok? If you queue these packets 〔补回 EAA004，待核〕 according to the order in which they arrive, we say that this queue works in a FIFO manner, that is, first input, first output.",
      "source_block_ids": [
        "25"
      ],
      "change_ids": [
        "EAC013",
        "EAC014",
        "EAA004",
        "EAF034",
        "EAF035",
        "EAF049",
        "EAF050"
      ],
      "timestamps_are_anchors": true
    },
    {
      "paragraph_id": "P27",
      "text": "So, who arrives first will be served first, and we get out first, right? So, let's assume that we have this FIFO queue. So, our MAC layer, when we have the transmitter, we can model the MAC as a queue, right? Where packets arrive, they are queued in a FIFO according to the FIFO policy. And then the function that is implemented at the MAC layer, we will serve these packets one at a time. And a packet finishes to be served when it gets out and can proceed to the physical layer.",
      "source_block_ids": [
        "27"
      ],
      "change_ids": [
        "EAC015",
        "EAF004",
        "EAF005",
        "EAF006",
        "EAF007",
        "EAF008",
        "EAF036"
      ],
      "timestamps_are_anchors": true
    },
    {
      "paragraph_id": "P29",